PID,DID,Conference,IsTopTier,Paper,Code Form,Domain,Analysis,Analysis Artifact,Artifact class,Transformation,Artifact form,Canonicalization,Canonicalization_Method,Split basis,Token Unit,Tokenization_Technique,Encoding,Encoding_NAs,Encoding examples,Embedding_Method,Embedding examples,Learning_Category,Learning_Subcategory,Learning_Trainable,for claude,Learning_Model,Learning_Model(Old),Inference_Category,Inference_Subcategory,Inference_Output,Evaluation_Metric
P057,D10,CCS,TRUE,SymLM: Predicting Function Names in Stripped Binaries via ContextSensitive Execution-Aware Code Embeddings,"Fetched instruction, Assembly",Function symbol name recovery,Dynamic > Forced execution | Static > control-flow analysis; Static > call-site analysis,instruction trace; runtime-value trace | ICFG,Text streams; Text streams | Graph representations,Text streams; Text streams -> Sequence | Graph representation -> Numeric descriptor,Sequence | Numeric descriptor,Abstraction by replacement   | N/A,N/A,Syntactic units | N/A,Instruction | N/A,Output label: camelCase + snake_case splitting + unigram LM word segmentation from CodeSearchNet 1.5M function-name corpus (Sec 4.2) | N/A (calling-context aggregation only),Sparse | Dense,N/A | N/A,N/A | N/A,Context-dependent | Context-independent,Transformer-based | lookup layer,Discriminative,Classification,Yes,Transformer-based || lookup layer,(Transformer-based; Trex || lookup layer) + MLP decoder,SymLM (TREX encoder + calling context embedding + 2-layer MLP decoder),Recovery,Symbol-name / pseudocode generation,Generated function name (subword sequence),Precision; Recall; F1 score
P058,D10,AsiaCCS,FALSE,A Transformer-based Function Symbol Name Inference Model from an Assembly Language for Binary Reversing,Assembly,Function symbol name recovery,Static > Disassembly,Raw x86-64 assembly instruction sequences,Code representations,Code representation -> Sequence,Sequence,,,data-driven,Byte pair encoding (Subword (BPE)),Byte pair encoding (Subword (BPE)),,Dense,"Subword (BPE) subword token IDs -> learned token embedding lookup (~40M params for DS_A, ~32M for DS_N; Sec 5 Table 2) + per-layer absolute positional embedding added at every encoder layer (Sec 4.3 + Fig 4)",Context-dependent,AsmDepictor Transformer (per-layer positional embedding + Unique-softmax),Generative,Generative,Yes,,AsmDepictor / encoder-decoder Transformer,AsmDepictor Transformer (3 encoder/decoder layers 40M params),Recovery,Symbol-name / pseudocode generation,Generated function name token sequence,Precision; Recall; F1; ROUGE-L; Jaccard*
P059,D10,S&P,TRUE,XFL: Naming Functions in Binaries with Extreme Multi-label Learning,"Assembly, VEX IR",Function symbol name recovery,Static > Control-flow analysis | Static > call-site analysis | Triage > Structrual analysis; Static > Disassembly; Static > IR lifting; Static > static taint analysis,ICFG | CG | assembly; IR; imports; constants; tainted values,Graph representations | Graph representations | Code representations; Code representations; Binary facts; Binary facts; Binary facts,Graph representations -> Numeric descriptor | Graph representations -> Numeric descriptor | Code representations; Code representations; Binary facts; Binary facts; Binary facts -> Numeric descriptor,Numeric descriptor | Numeric descriptor | Numeric descriptor ,N/A | N/A | feature value scaling,N/A,N/A | N/A | N/A,N/A | N/A | N/A,N/A,Dense | Dense | Dense,Dense,N/A | N/A | N/A,Context-independent | Context-independent | Context-independent,LDP | BoostNE | Autoencoder,Discriminative,Classification,Yes,(LDP || BoostNE ) -> Autoencoder,((LDP || BoostNE ) -> Autoencoder ) + MLP classifier,XFL (DEXTER autoencoder + PfastreXML + trigram LM),Classification,Multi-label classification,Multi-hot function name label vector,Precision; Recall; F1; AUC
P062,D10,USENIX Security,TRUE,BLens: Contrastive Captioning of Binary Functions using Ensemble Embedding,Assembly,Function symbol name recovery,[Pamtree] Static > Disassembly; Static > Control-dependence analysis; Static > Data-dependence analysis | [CLAP] Static > Disassembly | [DEXTER] Static > Control-flow analysis; Static > call-site analysis; Triage > Structrual analysis; Static > Disassembly; Static > IR lifting; Static > static taint analysis,assembly | assembly | ICFG; assembly; IR; imports; constants; tainted values,Code representations | Code representations | Graph representation; Code representations; Code representations; Binary facts; Binary facts; Binary facts,Code representations -> Sequence | Code representations  -> Sequence  | Graph representation; Code representations; Code representations; Binary facts; Binary facts; Binary facts -> Numeric descriptor,Sequence | Sequence | Numeric descriptor,Abstraction by replacement  | Abstraction by replacement  | feature value scaling,N/A,Data-driven segmentation | Data-driven segmentation | N/A,Subword (BPE) | Subword (BPE)  | N/A,Instruction-level (inherited from PalmTree BERT tokenizer + CLAP tokenizer; Sec 4.1) | N/A (DEXTER produces statistical feature vector directly),Sparse | Sparse | Dense,Sparse | Dense,N/A | N/A | N/A,Context-dependent | Context-dependent | Context-independent,BERT-based (PalmTree) | BERT-based (CLAP) | (LDP || BoostNE ) -> Autoencoder ),Generative,Generative,Yes,BERT-based || BERT-based || ((LDP || BoostNE ) -> Autoencoder ),(PalmTree || CLAP || (LDP || BoostNE ) -> Autoencoder))  +  LORD Transformer decoder,BLens (COMBO pretraining + LORD fine-tuning; 153M params),Recovery,Symbol-name / pseudocode generation,Generated function name caption,Precision; Recall; F1; RougeL; Bleu; VarCLR
P063,D11,CCS,TRUE,Debin: Predicting Debug Information in Stripped Binaries,"Assembly, BAP-IR",Variable symbol name recovery,Static > IR lifting; Static > Data-flow analysis; Static > Data-dependence analysis; Static > Call-site analysis; Static > Stack-frame analysis; Triage > Binary profiling | Static > Data-dependence analysis,IR; def-use chains; PDG; CG; Stack-frame layout; strings; constants | PDG,Code representations; Graph representations; Graph representations;  Graph representations;  Binary facts; String literals; Binary facts  | Graph representations,Code representations; Graph representations; Graph representations;  Graph representations;  Binary facts; String literals; Binary facts -> Numeric descriptor | Graph representations -> Graph,Numeric descriptor | Graph,"N/A | node attribute mapping, edge attribute mapping",N/A | N|A,N/A | N|A,N/A | N|A,N/A | N/A,Sparse | Sparse,Sparse | N/A,"One-hot | Node attribute IDs, Edge attribute IDs",N/A | N/A ,N/A | N/A,Discriminative,Classification,Yes,N/A | N/A,Extremely Randomized Trees -> CRF + MAP,Debin (Extremely Randomized Trees + CRF over undirected factor graph),Recovery,Probabilistic structural recovery,Variable name posterior,Accuracy; Precision; Recall; F1 score
P064,D11,ICPC,FALSE,Meaningful Variable Names for Decompiled Code: A Machine Translation Approach,Decompiled code,Variable symbol name recovery,Static > Decompilation,Decompiled source code,Code representations,Code representation -> Sequence,Sequence,,,rule-based,Whitespace-based,Whitespace-based,,Sparse,"N/A (Moses phrase-based SMT uses n-gram language model P(e) + phrase translation table P(f|e) probabilities, NOT learned embeddings; Sec 2.1 Bayes-rule MAP: argmax_e P(e)·P(f|e))",N/A,N/A,Generative,Generative,Yes,,Phrase-based SMT,Moses phrase-based SMT (n-gram LM + phrase translation model),Recovery,Symbol-name / pseudocode generation,Statistical-MT generated variable name,Exact match rate; combined exact+approximate match rate
P065,D11,ASE,FALSE,DIRE: A Neural Approach to Decompiled Identifier Naming,Decompiled code,Variable symbol name recovery,Static > Decompilation | Static > Decompilation,Decompiled source code | AST of decompiled function,Code representations | Graph representations,Code representation -> Sequence | Graph representation -> Graph,Sequence | Graph,,,data-driven,Unigram language model,Unigram language model,,Dense,"SentencePiece subword token IDs -> learned token embeddings dim 128 -> BiLSTM (hidden 128, bidirectional) for x_i = [→h_i; ←h_i] (Sec III-B1) | 3 component embeddings (syntactic type, data type subtoken mean, name subtoken mean) -> linear projection of concat for initial node state h_v,0 (Sec III-B2a)",Context-dependent,BiLSTM; GGNN (8 message-passing steps 5 edge types),Generative,Generative,Yes,,DIRE / BiLSTM + GGNN + LSTM decoder,DIRE (BiLSTM lexical encoder + GGNN structural encoder + LSTM decoder),Recovery,Symbol-name / pseudocode generation,Generated identifier name sequence,Accuracy; character error rate (CER); edit distance
P066,D11,USENIX Security,TRUE,Augmenting Decompiler Output with Learned Variable Names and Types,Decompiled code,Variable symbol name recovery,Static > Decompilation | Static > Stack-frame analysis,Pseudocode | Stack-frame layout,Code representations | Binary facts,Code representations -> Sequence | Binary facts -> Sequence,Sequence | Sequence,Abstraction by replacement  | Abstraction by replacement ,N/A,Data-driven segmentation | Rule-based decomposition,Subword (BPE) | Custom rule,Byte pair encoding (Subword (BPE)) | Delimiter/symbol-based,Sparse | Sparse,N/A,N/A | N/A ,Context-dependent | Context-dependent,Transformer-based | Transformer-based,Generative,Generative,Yes,Transformer-based || Transformer-based,(Transformer-based || Transformer-based) + Transformer-based,DIRTY (Transformer Code Encoder + Data Layout Encoder + autoregressive Type/Name Decoder),Recovery,Symbol-name / pseudocode generation,Variable name + variable type,Name Match; Type Match; prediction accuracy
P067,D11,S&P,TRUE,"“Len or index or count, anything but v1”: Predicting Variable Names in Decompilation Output with Transfer Learning",Decompiled code,Variable symbol name recovery,Static > Decompilation,Pseudocode,Code representations,Code representation -> Sequence,Sequence,Abstraction by replacement ,N/A,Data-driven segmentation,Subword (BPE),Byte pair encoding (Subword (BPE)),Sparse,N/A,N/A,Context-dependent,BERT-based,Discriminative,Classification,Yes,BERT-based,BERT-based + MLP classifier,VARBERT (6-layer BERT with CMLM pretraining + fine-tuning),Recovery,Symbol-name / pseudocode generation,Predicted variable name; predicted variable type,Top-1 accuracy; Top-3 accuracy; Top-5 accuracy; average edit distance (AED); character error rate (CER); Accuracy; F1
P068,D11,NDSS,TRUE,Unleashing the Power of Generative Model in Recovering Variable Names from Stripped Binary,Decompiled code,Variable symbol name recovery,Static > Decompilation; Static > call-site analysis,Pseudocode; CG,Code representation; Graph representation,Code representation; Graph representation -> Sequence,Sequence,Abstraction by replacement ,Decompiled identifier replacement | N/A,Data-driven segmentation,Subword (Pretrained-LLM),Inherited LLM tokenizer (CodeGemma/CodeLlama Subword (BPE)) | Inherited LLM tokenizer (CodeGemma/CodeLlama Subword (BPE)),Sparse,N/A,N/A,Context-dependent,Transformer-based,LLM-based,LLM-based finetuning,Yes,Transformer-based,CLM fine-tuning (CodeGemma/CodeLlama ) + SymPO + post-processing (iterative call-graph context propagation + data-flow name validation),GENNM (CodeGemma-2B/CodeLlama fine-tuned with CLM + SymPO),Recovery,Symbol-name / pseudocode generation,Generated variable name sequence,Precision; Recall; GPT4Evaluator score
P070,D12,NDSS,TRUE,When Coding Style Survives Compilation: De-anonymizing Programmers from Executable Binaries,"Assembly, Decompiled code",Programmer authorship classification,Static > Disassembly; Triage > Structural analysis; Triage > Binary profiling | Static > Control-flow analysis | Static > Decompilation | Static > Decompilation,Assembly; imports; strings | CFG | Pseudocode | AST,Code Representations; Binary Facts; String Literals | Graph Representations | Code Representations | Graph Representations,Code Representations; Binary Facts; String Literals -> Numeric descriptor | Graph representation -> Numeric descriptor | Code representation -> Numeric descriptor | Graph representation -> Numeric descriptor,Numeric descriptor | Numeric descriptor | Numeric descriptor | Numeric descriptor,N/A | N/A | N/A | N/A,Assembly instruction element replacement | N/A | N/A | N/A,N/A | N/A | N/A | N/A,N/A | N/A | N/A | N/A,N/A | N/A | N/A | N/A,Dense | Dense | Dense | Dense,Dense | Dense | Dense | Dense,count vector;  frequency vector | count vector;  frequency vector  |  count  vector; frequency vector| frequency vector; TF-IDF,N/A | N/A | N/A | N/A,N/A | N/A | N/A | N/A,Discriminative,Classification,Yes,N/A | N/A | N/A | N/A,Random Forest,Random Forest (500 trees) + Linear SVM,Classification,Multi-class classification,Programmer ID label,Accuracy
P072,D12,SANER,FALSE,BinMLM: Binary Authorship Verification with Flow-aware Mixture-of-Shared Language Model,Assembly,Programmer authorship classification,Static > Disassembly; Static > Inter-procedural control flow analysis,Flow-aware opcode n-gram sequences,Code representations,Code representation -> Sequence,Sequence,Element removal,Assembly instruction element removal,granularity-based,Opcode,Opcode-level: single opcode -> sliding-window of size n -> opcode n-gram units g_i (each g_i = a continuous sequence of n opcodes; Sec IV-B1); LM predicts subsequent n-gram unit at multiple-hop horizon for distinguishability,,Dense,Opcode n-gram unit indices -> learned dense embedding vectors e_t via embedding layer (Sec III-A Eq 2: 'we first transform each token u_i into a vector e_t through an embedding layer'); embedding dim 64 per Sec V-A 'The hidden dimension of the embedding layer and LSTM encoder is set to 64',Context-dependent,Mixture-of-shared LSTM (s=5 shared LSTMs + author-specific gates),Generative,Generative,Yes,,RNN language model,BinMLM mixture-of-shared RNN language model,Classification,Binary classification,Author verification decision,AUC-ROC; average precision
P073,D13,IEEE Access,FALSE,Fine-Grained Compiler Identification With Sequence-Oriented Neural Modeling,Assembly,Toolchain provenance classification,Static > Disassembly,Assembly instruction sequences,Code representations,Code representation -> Sequence,Sequence,Element replacement,Assembly instruction element replacement,granularity-based,Instruction,"Instruction-level: each normalized assembly instruction = one token (one word in skip-gram vocabulary); basic block = sentence; function = sequence S_f = {ins_1, ins_2, ..., ins_n} (Sec III + IV-A)",,Dense,"Skip-gram Word2Vec dense embeddings over normalized-instruction tokens (Sec IV-A): vocabulary of all unique normalized instructions; each basic block treated as a sentence; window w=5, 100 epochs, LR=0.001, dim d=100 (Sec IV-A + V-B); embeddings stacked into raw feature matrix A = [e_1, e_2, ..., e_l]^T in R^(l x d) with l=500 (zero-padded/truncated, Sec V-B)",Context-independent,Word2Vec skip-gram (dim=100),Discriminative,Classification,Yes,,CNN + BiGRU with attention,NeuralCI (CNN/BiGRU with attention variants),Classification,Multi-class classification,Compiler family / version label,Accuracy; Precision; Recall; F1
P075,D13,CCS,TRUE,Improving Security Tasks Using Compiler Provenance Information Recovered At the Binary-Level,Assembly,Toolchain provenance classification,Static > Disassembly,Assembly,Code representations,Code representation -> Numeric descriptor,Numeric descriptor,N/A,Assembly instruction element replacement,N/A,N/A,N/A,Sparse,N/A,multi-hot,Context-independent,N/A,Discriminative,Classification,Yes,N/A,LightGBM,LightGBM (68 passes; multi-class for Rich header),Classification,Multi-label classification,Optimization-pass label vector,Recall; F-1 score
P077,D14,ICPR,FALSE,A Weak Coupling of Semi-Supervised Learning with Generative Adversarial Networks for Malware Classification,Byte,Malware family classification,Triage > Structural analysis,Raw binary bytes as 1D image,Code representations,Code representation -> Image,Image,Image size scaling,Image size scaling,N/A,N/A,N/A,,Dense | Dense,"1D image input (1 x 4096 x 1) to 1D-CNN: 5 convolutional layers (kernel size 1 throughout, channels 64 -> 128 -> 256 -> 512 -> 512, stride 1; max-pool kernel 16 stride 4 between conv layers; Sec III-B + Fig 5); flattened then 4 dense layers (1024 -> 2048 -> 256 -> 9) with dropout; ReLU activations + softmax 9-class output",Context-dependent,1D-CNN (VGG-inspired),Discriminative,Classification,Yes,,1D-CNN + SGAN,1D-CNN + weak coupling SGAN (semi-supervised),Classification,Multi-class classification,Malware family label,Accuracy; Error rate; per-family recall
P078,D17,Information Sciences,FALSE,AI-HydRa: Advanced hybrid approach using random forest and deep learning for malware classification,Byte,Malware detection,Triage > Structural analysis; Triage > Functional profiling | Dynamic > Runtime behavioral monitoring,PE features | Dynamic behavior features,Binary facts | Binary facts,Binary facts -> Numeric descriptor | Binary facts -> Numeric descriptor,Numeric descriptor | Numeric descriptor,N/A,N/A,N/A,N/A,N/A,,Dense | Dense,79-d numeric feature vector for static (5 feature classes per Table 1: Size 7 features + Count 5 features + Entropy 5 features + Entry point 1 + IAT 61 predefined API functions) | 432-d numeric feature vector for dynamic per Sec 4.3.9 (MLP_dynamic uses 432 features from API/Location/Mutex/Network/Registry classes per Table 2),N/A | N/A,N/A | N/A,Discriminative,Classification,Yes,,Random Forest + MLP ensemble,AI-HydRa (RF_static + RF_dynamic + MLP_static + MLP_dynamic + DMA voting),Detection,Sample-level detection,Malicious / benign label,Accuracy; Precision; TP rate; FP rate; ROC
P079,D14,DIMVA,FALSE,MtNet: A Multi-Task Neural Network for Dynamic Malware Classification,Fetched instruction,Malware family classification,Dynamic > Runtime behavioral monitoring | Dynamic > Memory forensics,API call event sequences | object strings,Text streams | Snapshots,Text streams -> Numeric descriptor | Snapshot -> Numeric descriptor,Numeric descriptor | Numeric descriptor,Feature selection | Feature selection,Numeric value scaling,N/A,N/A,N/A,,Sparse | Sparse,"3 sparse binary feature sets (Sec 3 Features): (1) null-terminated objects presence/absence (sec 3.2.1: 'majority of null-terminated objects are unpacked strings but a few correspond to individual code fragments'); (2) per-API-event+parameter combination indicators; (3) API trigram indicators (3 consecutive API events) for limited context. Feature selection via mutual information -> top 50,000 features (Sec 3 Feature Selection). Random projection (Sec 4.1 Eq 2): sparse matrix R 50000x4000 initialized with Pr(R_ij=1)=Pr(R_ij=-1)=1/(2*sqrt(d)), d=50000 -> 99.56% zero entries; reduces 50k-d sparse binary to 4000-d dense projected vector",Context-independent | Context-independent,Sparse-random-projection matrix R projects 50000-d sparse binary features to 4000-d dense vector input; not a learned embedding,Discriminative,Classification,Yes,,Multi-task DNN,MtNet multi-task DNN (4 hidden layers ReLU Dropout 2 output heads),Classification,Multi-class classification,Malware family label,Accuracy; TPR; FPR; ROC curve
P080,D14,CODASPY,FALSE,"Novel Feature Extraction, Selection and Fusion for Effective Malware Family Classification","Byte, Assembly",Malware family classification,Triage > Structural analysis; Triage > Functional profiling | Static > Disassembly; Triage > Structural analysis; Triage > Functional profiling,Byte stats | Operation section,Code representations | Code representations,Code representation -> Numeric descriptor | Code representation -> Numeric descriptor,Numeric descriptor | Numeric descriptor,Feature selection | Feature selection,Numeric value scaling | N/A,N/A,N/A,N/A,,Dense | Dense,"Hex-dump features (Sec 3.2.1): 1G byte 1-gram (256-d), ENT 4-statistic summary of 10000-byte sliding-window entropy distribution (mean/variance/quantiles/percentiles per Eq 1), IMG1 Haralick texture features (52-d), IMG2 Local Binary Pattern features (108-d), STR ASCII-string-length histogram (116-d), MD1 metadata 2-d (file size + first-bytes address hex->decimal) | Disassembled-file features (Sec 3.2.2): MD2 metadata 2-d, SYM 8 symbol frequencies, OPC 93 selected x86 mnemonic frequencies, REG 26 register-name frequencies, API 796 frequent API frequencies, SEC 25 PE-section line-counts/proportions (Table 2), DP 24 db/dw/dd-with-N-parameters proportions (Table 3), MISC 95 manually-chosen-keyword frequencies. 13 categories total; combination of all = 1804-d feature vector (Sec 4.3 Table 4-6); top combination C12 = 1696 features",N/A,N/A,Discriminative,Classification,Yes,,XGBoost + Bagging ensemble,XGBoost + Bagging (100 estimators),Classification,Multi-class classification,Malware family label,Accuracy; Logloss
P081,D17,S&P,TRUE,Transcending transcend: Revisiting malware classification in the presence of concept drift,Byte,Malware family classification,Triage > Structural analysis; Triage > Binary profiling,Header; sections; imports; exports; histogram; strings; entropy,Binary Facts; Binary Facts; Binary Facts; Binary Facts; Numerical Statistics; String Literals; Numerical Statistics,Binary Facts; Binary Facts; Binary Facts; Binary Facts; Numerical Statistics; String Literals; Numerical Statistics -> Numeric descriptor,Numeric descriptor,Feature value scaling,N/A,N/A,N/A,N/A,Dense,N/A,N/A,N/A,N/A,Discriminative,Detection,Yes,N/A,GBDT +  ICE conformal evaluator (p-value based),TRANSCENDENT framework (conformal evaluation) + Linear SVM,Clustering,Anomaly / drift detection via clustering,Conformal credibility/confidence; rejection flag,F1; Precision; Recall; Area Under Time (AUT); rejection rate
P082,D14,AAAI,TRUE,Classification of Malware by Using Structural Entropy on Convolutional Neural Networks,Byte,Malware family classification,Triage > Binary profiling,Entropy,Numerical Statistics,Numerical statistics -> Sequence,Sequence,N/A,N/A,Rule-based decomposition,Custom rule,N/A,Dense,N/A,time-series vectors,N/A,N/A,Discriminative,Classification,Yes,N/A,CNN + mlp classifeir,CNN on Haar Wavelet multiresolution entropy + Bagging,Classification,Multi-class classification,Malware family label,Accuracy; F1 score; Logloss
P083,D14,S&P,TRUE,From grim reality to practical solution: Malware classification in real-world noise,Byte,Malware family classification,Triage > Binary profiling; Triage > Structural analysis; Triage > Binary profiling; Triage > Structural analysis,entropy;  imports; strings; header,Numerical Statistics; Binary Facts; String Literals; Binary Facts,Numerical Statistics; Binary Facts; String Literals; Binary Facts -> Numeric descriptor,Numeric descriptor,Feature value scaling,N/A,N/A,N/A,N/A,Dense,N/A,count vector ,N/A,N/A,Discriminative,Classification,Yes,N/A,MLP with ReLU,MORSE (3-layer MLP + FixMatch + trust score re-weighting),Classification,Multi-class classification,Malware family label,Accuracy; Precision; Recall; F1
P084,D14,AAAI,TRUE,MalCL: Leveraging GAN-Based Generative Replay to Combat Catastrophic Forgetting in Malware Classification,Byte,Malware family classification,Triage > Structural analysis; Triage > Structural analysis; Triage > Structural analysis; Triage > Structural analysis; Triage > Binary profiling,Header; sections; imports; exports; entropy,Binary Facts; Binary Facts; Binary Facts; Binary Facts; Numerical Statistics,Binary Facts; Binary Facts; Binary Facts; Binary Facts; Numerical Statistics -> Numeric descriptor,Numeric descriptor,Feature value scaling,N/A,N/A,N/A,N/A,Dense,Dense,N/A,N/A,N/A,Discriminative,Classification,Yes,N/A,Generator: CNN; Classifier: CNN + FC,MalCL (Conv1D classifier + GAN generative replay + FML),Classification,Multi-class classification,Malware family label,Accuracy
P085,D14,IJCNN,FALSE,Empowering convolutional networks for malware classification and analysis,"Byte, Assembly",Malware family classification,Triage > Structural analysis | Triage > Structural analysis | Static > Disassembly,PE Metadata | PE features | Assembly Opcode Features,Binary facts | Binary facts | Code representations,Binary facts -> Numeric descriptor | Binary facts -> Numeric descriptor | Code representations -> Sequence,Numeric descriptor | Numeric descriptor | Sequence,N/A | N/A | N/A,N/A | N/A | N/A,N/A | N/A | granularity-based,N/A | N/A | Opcode,N/A | N/A | Opcode-level,,Dense | Dense | Sparse,"27-d numeric feature vector: 3 PE Header metadata (compile timestamp + offset addresses + size of image resources) + per-code-section 4 features (entropy + virtual address + virtual size + size on disk; 6 sections) = 27 numerical features total (Sec III-B PE Metadata) | 488-d one-hot encoded vector over unique (DLL, function) pairs per Sec III-B PE Import Features: 'we encode the presence of unique functions along with their associated DLLS using the one-hot encoding approach... we counted 488 unique functions from the PE files in our collection' | N x 118 one-hot encoded matrix: each opcode in the sequence represented as a 118-d one-hot row vector (118 = total unique opcodes in vocabulary); sequence ORDER preserved for CNN convolution per Sec III-B Assembly Opcode Features: 'we convert the generated sequence of opcodes into a matrix representation, where each row of the matrix is a vector representation of one opcode in the sequence'",Context-independent | Context-independent | Context-dependent,N/A | N/A | Hybrid NN,Discriminative,Classification,Yes,,Feedforward neural network + CNN,Hybrid NN (Feedforward branch + CNN branch),Classification,Multi-class classification,Malware family label,Precision; Recall; F1-score
